{
  "artifact": "TFII_to_FINOS_CDM_Conformance_Test_001",
  "version": "1.0.0",
  "as_of": "2026-07-16",
  "status": "CONTROLLED_VALIDATED",
  "test_rule": "A TFII requirement passes only when the inspected FINOS CDM revision provides a native typed path that preserves the requirement's decisive financial meaning. Generic taxonomy values, free text, implementation metadata, or an unmodelled external convention do not count as native conformance.",
  "target_standard": {
    "name": "FINOS Common Domain Model",
    "repository": "https://github.com/finos/common-domain-model",
    "revision": "a6ffe777bc12ef3d289579cb3a86d1cbffea63d2",
    "revision_date": "2026-07-15",
    "inspected_paths": [
      "rosetta-source/src/main/rosetta/base-staticdata-asset-common-type.rosetta",
      "rosetta-source/src/main/rosetta/base-staticdata-party-enum.rosetta",
      "rosetta-source/src/main/rosetta/event-common-enum.rosetta",
      "rosetta-source/src/main/rosetta/event-common-type.rosetta",
      "rosetta-source/src/main/rosetta/event-workflow-type.rosetta",
      "rosetta-source/src/main/rosetta/product-collateral-func.rosetta",
      "rosetta-source/src/main/rosetta/product-collateral-type.rosetta"
    ]
  },
  "tfii_source": {
    "methodology": "docs/reference_data/FET_TFII_Record_Contract_001.md",
    "public_sample": "output/public_repository/the-token-is-not-the-financial-instrument/release/v1.0/Public Evidence/Tokenized Financial Instrument Integrity - Public Sample - v1.0.json",
    "public_repository": "https://github.com/DarwinRampai/the-token-is-not-the-financial-instrument",
    "doi": "https://doi.org/10.5281/zenodo.21399416",
    "record_ids": [
      "FET-TFII-001",
      "FET-TFII-002",
      "FET-TFII-003",
      "FET-TFII-004",
      "FET-TFII-005"
    ]
  },
  "requirements": [
    {
      "requirement_id": "TFII-CDM-001",
      "tfii_field": "financial_object",
      "financial_question": "Can the tokenized fund share be represented as the underlying financial instrument rather than as a generic digital asset?",
      "materiality": "CORE",
      "cdm_candidate_paths": ["Asset.Instrument.Security", "AssetBase.identifier", "AssetBase.taxonomy", "Security.fundType"],
      "native_capability": "CDM represents a fund share as a Security within Instrument and provides typed identifiers, taxonomy and fund classification.",
      "extension_or_control_needed": "No TFII extension is required for base instrument identity.",
      "status": "PASS",
      "evidence": {
        "source_class": "FINOS_CDM_SOURCE",
        "source_uri": "https://github.com/finos/common-domain-model/blob/a6ffe777bc12ef3d289579cb3a86d1cbffea63d2/rosetta-source/src/main/rosetta/base-staticdata-asset-common-type.rosetta",
        "source_revision": "a6ffe777bc12ef3d289579cb3a86d1cbffea63d2",
        "source_locator": "AssetBase, Instrument choice and Security type",
        "derivation_status": "OBSERVATION",
        "confidence": "High"
      }
    },
    {
      "requirement_id": "TFII-CDM-002",
      "tfii_field": "record_keeper",
      "financial_question": "Can relevant transfer-agent, registrar, settlement-centre and custodian parties be identified?",
      "materiality": "CORE",
      "cdm_candidate_paths": ["AssetBase.ancillaryPartyRole", "AssetAncillaryPartyRoleEnum.TransferAgent", "AssetAncillaryPartyRoleEnum.Registrar", "AssetAncillaryPartyRoleEnum.Custodian"],
      "native_capability": "CDM provides typed ancillary roles for the parties that maintain or process security records.",
      "extension_or_control_needed": "A separate TFII control is still needed to identify which party's record is authoritative.",
      "status": "PASS",
      "evidence": {
        "source_class": "FINOS_CDM_SOURCE",
        "source_uri": "https://github.com/finos/common-domain-model/blob/a6ffe777bc12ef3d289579cb3a86d1cbffea63d2/rosetta-source/src/main/rosetta/base-staticdata-party-enum.rosetta",
        "source_revision": "a6ffe777bc12ef3d289579cb3a86d1cbffea63d2",
        "source_locator": "AssetAncillaryPartyRoleEnum lines defining Registrar, TransferAgent, SecuritySettlementCentre, PlaceOfDeposit and Custodian",
        "derivation_status": "OBSERVATION",
        "confidence": "High"
      }
    },
    {
      "requirement_id": "TFII-CDM-003",
      "tfii_field": "transfer_flow",
      "financial_question": "Can the movement of a security between parties be represented?",
      "materiality": "CORE",
      "cdm_candidate_paths": ["TransferBase", "TransferState.transfer", "TransferBase.payerReceiver"],
      "native_capability": "CDM provides a typed asset transfer and payer-receiver relationship.",
      "extension_or_control_needed": "No TFII extension is required for the mechanical asset flow.",
      "status": "PASS",
      "evidence": {
        "source_class": "FINOS_CDM_SOURCE",
        "source_uri": "https://github.com/finos/common-domain-model/blob/a6ffe777bc12ef3d289579cb3a86d1cbffea63d2/rosetta-source/src/main/rosetta/event-common-type.rosetta",
        "source_revision": "a6ffe777bc12ef3d289579cb3a86d1cbffea63d2",
        "source_locator": "TransferState and TransferBase",
        "derivation_status": "OBSERVATION",
        "confidence": "High"
      }
    },
    {
      "requirement_id": "TFII-CDM-004",
      "tfii_field": "transfer_status",
      "financial_question": "Can the operational state of a transfer be represented?",
      "materiality": "CORE",
      "cdm_candidate_paths": ["TransferState.transferStatus", "TransferStatusEnum"],
      "native_capability": "CDM distinguishes instructed, pending, disputed, settled and netted transfer states.",
      "extension_or_control_needed": "TFII remains necessary to determine whether a settled operational transfer is also the ownership-effective event for the instrument.",
      "status": "PASS",
      "evidence": {
        "source_class": "FINOS_CDM_SOURCE",
        "source_uri": "https://github.com/finos/common-domain-model/blob/a6ffe777bc12ef3d289579cb3a86d1cbffea63d2/rosetta-source/src/main/rosetta/event-common-enum.rosetta",
        "source_revision": "a6ffe777bc12ef3d289579cb3a86d1cbffea63d2",
        "source_locator": "TransferStatusEnum",
        "derivation_status": "OBSERVATION",
        "confidence": "High"
      }
    },
    {
      "requirement_id": "TFII-CDM-005",
      "tfii_field": "valuation_clock",
      "financial_question": "Can value, time, method, source and scope be represented without conflating valuation time with transfer time?",
      "materiality": "CORE",
      "cdm_candidate_paths": ["Valuation.amount", "Valuation.timestamp", "Valuation.method", "Valuation.source", "Valuation.scope", "Valuation.valuationTiming"],
      "native_capability": "CDM represents a valuation observation and its timestamp, method or source, scope and timing.",
      "extension_or_control_needed": "CDM does not by itself identify the instrument-governing valuation calendar or prove that the supplied valuation is the authoritative one for the collateral workflow.",
      "status": "PARTIAL",
      "evidence": {
        "source_class": "FINOS_CDM_SOURCE",
        "source_uri": "https://github.com/finos/common-domain-model/blob/a6ffe777bc12ef3d289579cb3a86d1cbffea63d2/rosetta-source/src/main/rosetta/event-common-type.rosetta",
        "source_revision": "a6ffe777bc12ef3d289579cb3a86d1cbffea63d2",
        "source_locator": "Valuation type",
        "derivation_status": "BOUNDED_INTERPRETATION",
        "confidence": "High"
      }
    },
    {
      "requirement_id": "TFII-CDM-006",
      "tfii_field": "correction_lineage",
      "financial_question": "Can a corrected workflow state retain lineage to its prior state?",
      "materiality": "SUPPORTING",
      "cdm_candidate_paths": ["WorkflowStep.action", "ActionEnum.Correct", "WorkflowStep.previousWorkflowStep", "Lineage.eventReference"],
      "native_capability": "CDM can express a Correct action and preserve event or prior-workflow lineage.",
      "extension_or_control_needed": "The modelled action does not establish who has instrument-level authority to correct ownership or whether downstream systems adopted the correction.",
      "status": "PARTIAL",
      "evidence": {
        "source_class": "FINOS_CDM_SOURCE",
        "source_uri": "https://github.com/finos/common-domain-model/blob/a6ffe777bc12ef3d289579cb3a86d1cbffea63d2/rosetta-source/src/main/rosetta/event-workflow-type.rosetta",
        "source_revision": "a6ffe777bc12ef3d289579cb3a86d1cbffea63d2",
        "source_locator": "WorkflowStep action and previousWorkflowStep, read with Lineage in event-common-type.rosetta",
        "derivation_status": "BOUNDED_INTERPRETATION",
        "confidence": "High"
      }
    },
    {
      "requirement_id": "TFII-CDM-007",
      "tfii_field": "collateral_schedule",
      "financial_question": "Can a collateral schedule, inclusion or exclusion criteria, haircut and concentration limit be represented?",
      "materiality": "CORE",
      "cdm_candidate_paths": ["EligibleCollateralSpecification", "EligibleCollateralCriteria", "CollateralTreatment", "CollateralValuationTreatment", "ConcentrationLimit"],
      "native_capability": "CDM provides typed eligible-collateral criteria, inclusion or exclusion treatment, haircuts and concentration limits.",
      "extension_or_control_needed": "The schedule still needs an integrity precondition establishing that the queried token maps to the intended financial object and governing records.",
      "status": "PASS",
      "evidence": {
        "source_class": "FINOS_CDM_SOURCE",
        "source_uri": "https://github.com/finos/common-domain-model/blob/a6ffe777bc12ef3d289579cb3a86d1cbffea63d2/rosetta-source/src/main/rosetta/product-collateral-type.rosetta",
        "source_revision": "a6ffe777bc12ef3d289579cb3a86d1cbffea63d2",
        "source_locator": "EligibleCollateralSpecification, EligibleCollateralCriteria, CollateralTreatment and CollateralValuationTreatment",